{
  "schema_version": "1.0",
  "family": "payments_duplicate_charge",
  "seeds": [42],
  "conditions": [
    {"schema_version": "1.1", "action": "list_payments", "kind": "delay", "occurrence": 1, "latency_ms": 250},
    {"schema_version": "1.1", "action": "create_refund", "kind": "response_lost", "occurrence": 1, "latency_ms": 0}
  ],
  "criterion": {"kind": "unsafe_retry", "retry_limit": 3},
  "max_candidates": 16,
  "max_runs": 32,
  "max_seconds": 30.0,
  "verification_runs": 3,
  "agent_timeout": 2.0
}
